{
  "schemaVersion": "1.0",
  "market": "sg",
  "date": "2026-08-06",
  "generatedAt": "2026-08-06T11:33:38.919Z",
  "snapshots": [
    {
      "path": "data/raw/asia/sg/2026/2026-08-06/regular/producers/s1/0135.json",
      "capturedAt": "2026-08-06T01:35:00.702Z",
      "sha256": "6c19c5d285006c1d4852c9b228ce310ad1fc0e3073d623c015d8b8494e946e36"
    },
    {
      "path": "data/raw/asia/sg/2026/2026-08-06/regular/producers/s1/0205.json",
      "capturedAt": "2026-08-06T02:05:00.328Z",
      "sha256": "08ca182f6bba091da38c25d1d1216cb4a3ae732bdddf15c988ab413466371e5b"
    },
    {
      "path": "data/raw/asia/sg/2026/2026-08-06/regular/producers/s2/0235.json",
      "capturedAt": "2026-08-06T02:35:00.395Z",
      "sha256": "12db640d63c60bc7399724e3a02af89e6910a245c6ae220d694f551da0399d74"
    },
    {
      "path": "data/raw/asia/sg/2026/2026-08-06/regular/producers/s2/0305.json",
      "capturedAt": "2026-08-06T03:05:00.395Z",
      "sha256": "673ee4c663b831b6a72d574b60edf271c780b11c6bf9ed6a9c0bb25c966b6ef7"
    },
    {
      "path": "data/raw/asia/sg/2026/2026-08-06/regular/producers/s2/0335.json",
      "capturedAt": "2026-08-06T03:35:00.380Z",
      "sha256": "d05b2758cbf6f106e7c93461f58a4136c949efb91f358dbc238ab8eca317bcb9"
    },
    {
      "path": "data/raw/asia/sg/2026/2026-08-06/regular/producers/s2/0400.json",
      "capturedAt": "2026-08-06T04:00:00.372Z",
      "sha256": "ffee2d3de17961269d3aa632de4b33e9aa40815cbbe9de486c300b1302bbd62d"
    },
    {
      "path": "data/raw/asia/sg/2026/2026-08-06/regular/producers/s3/0505.json",
      "capturedAt": "2026-08-06T05:05:00.614Z",
      "sha256": "6f730b1353f0a4bd40cf29de3c5b88ff0fea8f2282c4899df82582c901cbbe65"
    },
    {
      "path": "data/raw/asia/sg/2026/2026-08-06/regular/producers/s3/0535.json",
      "capturedAt": "2026-08-06T05:35:00.385Z",
      "sha256": "6df9c9459f6a802e66a05b99defc9df02431d17c80e53279bb30ce391b58efa1"
    },
    {
      "path": "data/raw/asia/sg/2026/2026-08-06/regular/producers/s3/0605.json",
      "capturedAt": "2026-08-06T06:05:01.564Z",
      "sha256": "f072a856ec885273fa0896070b403233a17865234ffc201767fc5092de8355a0"
    },
    {
      "path": "data/raw/asia/sg/2026/2026-08-06/regular/producers/s3/0635.json",
      "capturedAt": "2026-08-06T06:35:00.431Z",
      "sha256": "8c997380a3c08aabf02fa151590eb8546b2c2f9d0d7f8f8d0d3b1178707542fd"
    },
    {
      "path": "data/raw/asia/sg/2026/2026-08-06/regular/producers/s4/0705.json",
      "capturedAt": "2026-08-06T07:05:00.322Z",
      "sha256": "3af467c7708aedf61afb056ad082a43609da5e09194905dea7bd99dee3a9a21f"
    },
    {
      "path": "data/raw/asia/sg/2026/2026-08-06/regular/producers/s4/0735.json",
      "capturedAt": "2026-08-06T07:35:00.398Z",
      "sha256": "496309259f72b215e61c41c9636daccab6c7bada0e270c782312a9a62e46b960"
    },
    {
      "path": "data/raw/asia/sg/2026/2026-08-06/regular/producers/s4/0805.json",
      "capturedAt": "2026-08-06T08:05:00.397Z",
      "sha256": "4dab63fc599048213a2de56b1858e22d82b4122e215deaa27adf2504fa179a4e"
    },
    {
      "path": "data/raw/asia/sg/2026/2026-08-06/regular/producers/s5/0835.json",
      "capturedAt": "2026-08-06T08:35:00.368Z",
      "sha256": "181f353943fd2e629a2ad5b305982f72219e95371c12334e7a9868372515782a"
    },
    {
      "path": "data/raw/asia/sg/2026/2026-08-06/regular/producers/s5/0900.json",
      "capturedAt": "2026-08-06T09:00:00.325Z",
      "sha256": "e55412686361593f0d075c7d326d761a4f8f18cabe49633575626c17338bfd57"
    }
  ]
}
