{
  "schemaVersion": "1.0",
  "market": "eu",
  "date": "2026-08-18",
  "generatedAt": "2026-08-18T20:38:18.011Z",
  "snapshots": [
    {
      "path": "data/raw/europe/eu/2026/2026-08-18/regular/producers/eu-tail-handoff-backup/1305.json",
      "capturedAt": "2026-08-18T13:05:00.423Z",
      "sha256": "18a8411d59789dd53a1f24faff7b63ab19a2ec59e7b67cf1eff5107973253e9f"
    },
    {
      "path": "data/raw/europe/eu/2026/2026-08-18/regular/producers/eu-tail-handoff-backup/1335.json",
      "capturedAt": "2026-08-18T13:35:00.431Z",
      "sha256": "e1694ccad2f2629d0733d83533b297465b40a391b62c128707ac9800cde728bc"
    },
    {
      "path": "data/raw/europe/eu/2026/2026-08-18/regular/producers/eu-tail-handoff-backup/1405.json",
      "capturedAt": "2026-08-18T14:05:00.395Z",
      "sha256": "b199193b0dcbb91766a19ed103cf3974ea714e080a67553928163eebb2f46515"
    },
    {
      "path": "data/raw/europe/eu/2026/2026-08-18/regular/producers/eu-tail-handoff-backup/1435.json",
      "capturedAt": "2026-08-18T14:35:00.597Z",
      "sha256": "5e11d255f0af717403d6d3ee361074ca5a262e233eea4a2134407cd176a36ef1"
    },
    {
      "path": "data/raw/europe/eu/2026/2026-08-18/regular/producers/eu-tail-handoff-backup/1505.json",
      "capturedAt": "2026-08-18T15:05:00.377Z",
      "sha256": "8a4823bd8f00d9a890bbcdb8b89ef9ccca1fe7a7d30b1b4302210809194ddc2c"
    },
    {
      "path": "data/raw/europe/eu/2026/2026-08-18/regular/producers/eu-tail-handoff-backup/1530.json",
      "capturedAt": "2026-08-18T15:30:00.692Z",
      "sha256": "7f9f24632adb2f2d071615753e89668c550c494b463c6e03b71e541065f847de"
    },
    {
      "path": "data/raw/europe/eu/2026/2026-08-18/regular/producers/s1/0715.json",
      "capturedAt": "2026-08-18T07:15:18.542Z",
      "sha256": "94485adf0b862d957e81b157e18168585301221d3b2d93739c35da3a0ab2afc3"
    },
    {
      "path": "data/raw/europe/eu/2026/2026-08-18/regular/producers/s1/0735.json",
      "capturedAt": "2026-08-18T07:35:00.506Z",
      "sha256": "0248aaf2cdd4098946052b4c354c740d21346e196ff01d35abfb2f4fb8bc7e14"
    },
    {
      "path": "data/raw/europe/eu/2026/2026-08-18/regular/producers/s1/0805.json",
      "capturedAt": "2026-08-18T08:05:00.527Z",
      "sha256": "daea1c24d110d2b63d876e8026d298e6538f7674fc9364a54dece0d13b887f1d"
    },
    {
      "path": "data/raw/europe/eu/2026/2026-08-18/regular/producers/s1/0835.json",
      "capturedAt": "2026-08-18T08:35:00.437Z",
      "sha256": "0cad763337595fe762e93ee3c8991cf5de18e7ca6924e5d37d74a3dc4a9f094f"
    },
    {
      "path": "data/raw/europe/eu/2026/2026-08-18/regular/producers/s2/0905.json",
      "capturedAt": "2026-08-18T09:05:00.482Z",
      "sha256": "12c158871e81e5f84cdb55b761c8c39aeac8bb49166d0447d97e17a5691e9c10"
    },
    {
      "path": "data/raw/europe/eu/2026/2026-08-18/regular/producers/s2/0935.json",
      "capturedAt": "2026-08-18T09:35:00.393Z",
      "sha256": "5df4f0e01b7c8e2a1334dd433b882a18984a6bd0d61e6e6284e624edd73e5be8"
    },
    {
      "path": "data/raw/europe/eu/2026/2026-08-18/regular/producers/s2/1005.json",
      "capturedAt": "2026-08-18T10:05:00.395Z",
      "sha256": "91146109e5cfc0db78dd04fee88218ea445348f3ec7e1ad2b17cd37c165106d9"
    },
    {
      "path": "data/raw/europe/eu/2026/2026-08-18/regular/producers/s2/1035.json",
      "capturedAt": "2026-08-18T10:35:00.365Z",
      "sha256": "c9f75235bebf363293f8c3f885b6f4e1db854734b29789f2e9027b8698e6015d"
    },
    {
      "path": "data/raw/europe/eu/2026/2026-08-18/regular/producers/s3/1105.json",
      "capturedAt": "2026-08-18T11:05:00.336Z",
      "sha256": "6f1ac87fb1e6bae77db8b0179c5fd32da66b1522eb0dceb506f0202ec6cfcb2d"
    },
    {
      "path": "data/raw/europe/eu/2026/2026-08-18/regular/producers/s3/1135.json",
      "capturedAt": "2026-08-18T11:35:00.383Z",
      "sha256": "f94fe56952b0db057558e310b5265bcbb456dd050d5830124f858f9cfad6c738"
    },
    {
      "path": "data/raw/europe/eu/2026/2026-08-18/regular/producers/s3/1205.json",
      "capturedAt": "2026-08-18T12:05:00.399Z",
      "sha256": "dfc9b496ed8bd7f7a1645ba355504b23ad4af44cc8da1049a885d879b882454f"
    },
    {
      "path": "data/raw/europe/eu/2026/2026-08-18/regular/producers/s3/1235.json",
      "capturedAt": "2026-08-18T12:35:00.352Z",
      "sha256": "48d3346e1c0d095a74b43fb87b0dac4e742729e49c605ffa244338867cf49680"
    },
    {
      "path": "data/raw/europe/eu/2026/2026-08-18/regular/producers/s4/1305.json",
      "capturedAt": "2026-08-18T13:05:00.464Z",
      "sha256": "1c5c0edc63356758a89845f152ae9443612b936d0e2af4d6b98b6153f3f2c71a"
    },
    {
      "path": "data/raw/europe/eu/2026/2026-08-18/regular/producers/s4/1335.json",
      "capturedAt": "2026-08-18T13:35:00.450Z",
      "sha256": "8272d3bbcf37a92a102c8e6fc24fba196d56ea39a03c340c6969c18bbf3c8339"
    },
    {
      "path": "data/raw/europe/eu/2026/2026-08-18/regular/producers/s4/1405.json",
      "capturedAt": "2026-08-18T14:05:00.420Z",
      "sha256": "46510e9108e9a431a2f963c53040cab65410a93bd0568c18e7eff806fbf49f34"
    },
    {
      "path": "data/raw/europe/eu/2026/2026-08-18/regular/producers/s4/1435.json",
      "capturedAt": "2026-08-18T14:35:00.957Z",
      "sha256": "1f2ed0054e9f69cb33b28514e630fdc311a1e3c9b2031b839a6397e9fb2a7001"
    },
    {
      "path": "data/raw/europe/eu/2026/2026-08-18/regular/producers/s5/1505.json",
      "capturedAt": "2026-08-18T15:05:00.509Z",
      "sha256": "cc88651ca6c1f8a5083fa28d5a7db5c820d3e0cbdecf59657c08b15952bbe996"
    },
    {
      "path": "data/raw/europe/eu/2026/2026-08-18/regular/producers/s5/1530.json",
      "capturedAt": "2026-08-18T15:30:00.340Z",
      "sha256": "bd302b2edc1b04cc9cd5c4fe925af6b743c6cb5848b1dbd0392f8d06a457f8da"
    }
  ]
}
