{
  "schemaVersion": "1.0",
  "market": "sg",
  "date": "2026-10-02",
  "generatedAt": "2026-10-02T15:50:10.824Z",
  "snapshots": [
    {
      "path": "data/raw/asia/sg/2026/2026-10-02/regular/producers/s1/0135.json",
      "capturedAt": "2026-10-02T01:35:00.376Z",
      "sha256": "8443ba3d631c8d076e3c5d4a41fb9ddbe4dcd9f199280536f67e0627465d27ae"
    },
    {
      "path": "data/raw/asia/sg/2026/2026-10-02/regular/producers/s1/0205.json",
      "capturedAt": "2026-10-02T02:05:01.157Z",
      "sha256": "76b0ebb495aa6f81befd92c5125f98bfd7fae58ade3931154e91bd4692418009"
    },
    {
      "path": "data/raw/asia/sg/2026/2026-10-02/regular/producers/s2/0235.json",
      "capturedAt": "2026-10-02T02:35:00.381Z",
      "sha256": "817641c84f3374bd99a0244faff314b29a0c747ce7fb130e17e567ad86a692f0"
    },
    {
      "path": "data/raw/asia/sg/2026/2026-10-02/regular/producers/s2/0305.json",
      "capturedAt": "2026-10-02T03:05:00.357Z",
      "sha256": "a39b42484ac0f9ac32189916be264072059aff11f7a7384ef3c03c042e7f748d"
    },
    {
      "path": "data/raw/asia/sg/2026/2026-10-02/regular/producers/s2/0335.json",
      "capturedAt": "2026-10-02T03:35:00.304Z",
      "sha256": "5949a12c8aa944e28ebba97b605a7ce245fe9b200a827c8e2762b66382191c07"
    },
    {
      "path": "data/raw/asia/sg/2026/2026-10-02/regular/producers/s2/0400.json",
      "capturedAt": "2026-10-02T04:00:00.299Z",
      "sha256": "62ccf2782cf59eafd005e8788580ceb1cc42e1bd0cc44dc1f58b62ca16be9962"
    }
  ]
}
