{
  "schemaVersion": "1.0",
  "market": "sg",
  "date": "2026-09-22",
  "generatedAt": "2026-09-22T14:02:37.882Z",
  "snapshots": [
    {
      "path": "data/raw/asia/sg/2026/2026-09-22/regular/producers/s1/0135.json",
      "capturedAt": "2026-09-22T01:35:00.374Z",
      "sha256": "72312b75df8473c137d6dea07b8d5384b2382c7ea2ac67754507f65171e3d9f9"
    },
    {
      "path": "data/raw/asia/sg/2026/2026-09-22/regular/producers/s1/0205.json",
      "capturedAt": "2026-09-22T02:05:00.346Z",
      "sha256": "17762e73383ecabc0818ece396d6851ee9be4623476fbb9157ed3fcb26effb6f"
    },
    {
      "path": "data/raw/asia/sg/2026/2026-09-22/regular/producers/s2/0235.json",
      "capturedAt": "2026-09-22T02:35:00.397Z",
      "sha256": "cb271735ed64475cefe5f69f2ff6e93eab8967f099f32dd08edf2b4992432f62"
    },
    {
      "path": "data/raw/asia/sg/2026/2026-09-22/regular/producers/s2/0305.json",
      "capturedAt": "2026-09-22T03:05:00.444Z",
      "sha256": "c23ac80db1520192979de032cebd112f1ade55d3b49abc9e17e525e8d6246189"
    },
    {
      "path": "data/raw/asia/sg/2026/2026-09-22/regular/producers/s2/0335.json",
      "capturedAt": "2026-09-22T03:35:00.415Z",
      "sha256": "c4dd26a1c45e2d28d8f5eec77562e7e9ec6189234b890da2f828989ad1fbae4e"
    },
    {
      "path": "data/raw/asia/sg/2026/2026-09-22/regular/producers/s2/0400.json",
      "capturedAt": "2026-09-22T04:00:00.287Z",
      "sha256": "78b8c5f7f6acd438ef35cfd87200275d002006347e0c15d354bf2f29c74f07e8"
    },
    {
      "path": "data/raw/asia/sg/2026/2026-09-22/regular/producers/s3/0605.json",
      "capturedAt": "2026-09-22T06:05:00.619Z",
      "sha256": "e5dc1253af27c21cf2472e38bf5961c6775d9788e2ee6ba98f29d0e41eb8c3b3"
    },
    {
      "path": "data/raw/asia/sg/2026/2026-09-22/regular/producers/s3/0635.json",
      "capturedAt": "2026-09-22T06:35:00.755Z",
      "sha256": "c79d490b534ab5fb7bd13a3ffcb160802871b9497e1d65db645cf0ecf4eea6a2"
    }
  ]
}
